[
  {
    "id": "fionnuala",
    "char": "npc_fili",
    "name": "Fionnuala the Wandering Fili",
    "kind": "flavor",
    "lines": [
      "The rift hums with half-remembered verses, wanderer. I have lost my meter chasing Bres's bridge — perhaps you'll finish the poem where I could not.",
      "Every poet needs an ending. Mine keeps slipping down through the floors, always one verse further than I can follow.",
      "I recite the old praise-songs to whatever still stands here. The stones don't answer, but they used to."
    ],
    "returnLine": "You again. Good — I hadn't finished my verse about you yet."
  },
  {
    "id": "cairn_keeper",
    "char": "npc_cairn_keeper",
    "name": "The Cairn-Keeper",
    "kind": "flavor",
    "lines": [
      "I have watched over these stones since before the causeway split the dark. Every fallen thing bruises Bres's bridge a little more. Keep bruising it.",
      "Each stone here was carried by someone who never came back for it. I've stopped counting. It stopped meaning anything, and started meaning everything.",
      "The dead don't need keepers. I stay for the ones still walking — you, for instance, though you won't thank me for it."
    ],
    "returnLine": "Still walking, I see. The cairn grows slower for it."
  },
  {
    "id": "fomorian_deserter",
    "char": "npc_deserter",
    "name": "A Fomorian Deserter",
    "kind": "flavor",
    "lines": [
      "I want no more of Bres's bridge-building. Let it stay unfinished — for all our sakes, and yours.",
      "They'll call me a coward for walking away. Let them. A finished bridge only leads somewhere worse.",
      "I've seen what waits on the far side of Bres's causeway. You haven't. Turn back while turning back still means something."
    ],
    "returnLine": "You're still descending? Stubborn. I respect it and I pity it in equal measure."
  },
  {
    "id": "aoife",
    "char": "npc_sidhe",
    "name": "Aoife, Oath-Bound",
    "kind": "bounty",
    "introLine": "Long ago I swore an oath the Otherworld itself couldn't unmake."
  },
  {
    "id": "fomorian_tinker",
    "char": "npc_tinker",
    "name": "A Fomorian Tinker",
    "kind": "trade",
    "introLine": "Otherworld power for Otherworld power, wanderer. Hand me one of your Geasa, and I'll press something rarer into your palm."
  },
  {
    "id": "seanchai",
    "char": "npc_seanchai",
    "name": "The Seanchaí of the Mound",
    "kind": "flavor",
    "lines": [
      "Sit a while. Before Bres turned his back on Ériu, he was our king — a beautiful, miserly king who taxed the smoke of our fires. The land itself sickened under him.",
      "Lugh came to Tara with every craft in his hands, and the doorkeeper laughed — 'we have one of each already.' 'But have you one who is all of them?' said Lugh. The door opened.",
      "Three brothers forged for the gods: Goibniu the smith, Luchta the wright, Credne the brazier. No blade they made ever missed, and no wound it gave ever healed.",
      "The Fomorians were not always monsters, you know. The sea remembers them as neighbours — hungry ones, but neighbours. It was Bres who taught them to take.",
      "This mound is older than the war above it. The Sídhe dug deep when the light left — deeper than Bres will ever build.",
      "They say the causeway he raises is made of everything Ériu lost — every stolen harvest, every cold hearth. Break it, and it all comes home.",
      "At the second battle of Mag Tuired, it was not strength that won — it was every craft turned to one purpose. Remember that, when the stone falls faster.",
      "When you meet him at last, look at his face. Bres means 'beautiful'. Ruin always is, from far enough away."
    ],
    "returnLine": "Back from the dark, and still in one piece. Sit — the fire has kept your place.",
    "waystationOnly": true
  },
  {
    "id": "tuan",
    "char": "npc_tuan",
    "name": "Tuan mac Cairill",
    "kind": "flavor",
    "lines": [
      "I have been a stag, an eagle, a boar, and a salmon, and I remember every invasion of Ireland from Partholón's landing on. This bridge of Bres's? I will remember how it ends, too. I always do.",
      "Do not pity me, wanderer. I watched every soul I knew die of plague and wore new shapes until the grief fit. There are worse fates down here than yours.",
      "The salmon-shape was best. You see everything from the water, and nothing expects you to fight."
    ],
    "returnLine": "Still the same shape as last time, I see. A pity. You'd make a passable eagle."
  },
  {
    "id": "ogma",
    "char": "npc_ogma",
    "name": "Ogma Grianainech",
    "kind": "flavor",
    "lines": [
      "I cut the first ogham into birch and stood it up as a warning, and men have been reading warnings ever since. Keep your feet under you when the stone falls — that is the whole of war, in the end.",
      "You grip your weapon like a farmer. Loosen the wrist. There — now you might live past the next floor.",
      "At Mag Tuired I took Orna from Tethra's own hand, and when I unsheathed it the blade recited every deed it had done. A boastful thing. But it had earned the boasting.",
      "They call me sun-faced. It is the strain of hauling the Fomorian dead off the field, if you want the truth of it. Bres's deep is filling with fresh ones. Do better than they did."
    ],
    "returnLine": "Back again, and still breathing. My teaching sticks to you better than it did to most."
  },
  {
    "id": "cliodhna",
    "char": "npc_cliodhna",
    "name": "Clíodhna of the Fair Hair",
    "kind": "flavor",
    "lines": [
      "I am queen of the banshees of Munster, wanderer, and I know the sound of every death that is coming. Yours I have not heard yet. Walk carefully and keep it that way.",
      "A wave took me once at Glandore — the tide that bears my name still runs there. Everything in the deep wants to sweep you away like that. Be heavier than your grief.",
      "My three bright birds could sing the sick to sleep and heal them with apples from the Otherworld tree. No birds down here. Only the stone, and what rides it."
    ],
    "returnLine": "Still no keening for you on the wind. Good. I had begun to listen for it."
  }
]